{
  "id": "softdevii-2024-fileappenderxml",
  "source": "SoftDevII-Project-2024-Backlog-derived",
  "repository": "evaluation/softdevii-2024",
  "prNumber": 1,
  "files": [
    {
      "filename": "src/data/FileAppenderXML.java",
      "status": "added",
      "fileContentPath": "../files/FileAppenderXML.java"
    }
  ],
  "labels": [
    {
      "file": "src/data/FileAppenderXML.java",
      "line": 24,
      "rule": "Duplicate Code",
      "targetType": "METHOD",
      "targetName": "appendFile",
      "severity": "Major",
      "note": "appendFile() follows the same high-level receipt-file update workflow as FileAppenderTXT.appendFile(), with only format-specific writing steps differing.",
      "suggestedRefactoring": "Form Template Method",
      "refactoringNote": "Move the common append workflow to FileAppender and implement only the XML-specific serialization steps in this subclass."
    }
  ]
}
