{
  "id": "softdevii-2025-favouritecategoriesstrategy",
  "source": "SoftDevII-Project-2025-Backlog-derived",
  "repository": "evaluation/softdevii-2025",
  "prNumber": 1,
  "files": [
    {
      "filename": "src/main/java/myy803/socialbookstore/datamodel/recomstrategies/FavouriteCategoriesStrategy.java",
      "status": "added",
      "fileContentPath": "../files/FavouriteCategoriesStrategy.java"
    }
  ],
  "labels": [
    {
      "file": "src/main/java/myy803/socialbookstore/datamodel/recomstrategies/FavouriteCategoriesStrategy.java",
      "line": 18,
      "rule": "Duplicate Code",
      "targetType": "METHOD",
      "targetName": "recommend",
      "severity": "Major",
      "note": "recommend() duplicates the same user-profile lookup and recommendation-return workflow used by the other recommendation strategies.",
      "suggestedRefactoring": "Form Template Method",
      "refactoringNote": "Move recommend() into an abstract recommendation-strategy base class and leave retrieveRecommendedBooks() as the subclass-specific step."
    }
  ]
}
